<?xml version="1.0" encoding="UTF-8"?>
<!DOCTYPE customers SYSTEM "customers.dtd">
<customers>
	<customer>
		<customer_id></customer_id>
		<customer_title></customer_title>
		<buisness_name></buisness_name>
		<billing_address></billing_address>
		<city></city>
		<state></state>
		<postal_code></postal_code>
		<country></country>
		<phone_no></phone_no>
		<cell_number></cell_number>
		<other_number></other_number>
		<fax_number></fax_number>
		<email_address></email_address>
		<customer_type></customer_type>
		<company_type></company_type>
		<contact_name></contact_name>
		<alternate_contactname></alternate_contactname>
		<date_entered></date_entered>
	</customer>
</customers>